{
  "group_id": "g5",
  "group_name": "Posición y progreso",
  "laws_subsumed": [
    "Efecto de posición serial",
    "Efecto de gradiente de meta"
  ],
  "channel": "wireframe",
  "not_applicable": false,
  "na_reason": null,
  "score": 0,
  "trigger": "lista_plana",
  "evidence_insufficient": true,
  "measurements": {
    "g5_listas_total": 4,
    "g5_lista_principal_sugerida": 815,
    "main_list_parent_id": 815,
    "J_inicio": false,
    "J_final": false,
    "Q": false,
    "G_existe": null,
    "G_nombra": null,
    "G_actual": null,
    "G_forma": null,
    "steps_declared": null,
    "lectura_screenshot": [
      "Q"
    ],
    "g5_lista_principal_sugerida_id": "g5:padre:815",
    "main_list_id": "g5:padre:815"
  },
  "findings": [
    {
      "observation": "La lista principal es el carrusel de categorías. En el wireframe sus opciones mantienen una presentación uniforme, sin jerarquía inicial ni final observable. Tampoco se aprecia jerarquía posicional en las listas secundarias: la mayor anchura de una etiqueta no basta para establecerla. El candidato del encabezado reúne regiones funcionales, sin demostrar una lista semántica.",
      "node_ids": [
        868,
        876,
        884,
        892,
        900,
        908,
        916
      ],
      "region": {
        "x": 0,
        "y": 0,
        "w": 1440,
        "h": 900
      },
      "severity": "alta"
    },
    {
      "observation": "La lista seleccionada está declarada parcial y con orden ambiguo. Sus cajas acumuladas y solapadas no permiten localizar con fiabilidad los extremos visibles; las diferencias de anchura suministradas no prueban diferenciación real. Se conservan las cifras y el puntaje queda limitado por esta evidencia.",
      "node_ids": [
        868,
        916
      ],
      "region": {
        "x": 0,
        "y": 0,
        "w": 1345,
        "h": 685.6
      },
      "severity": "media"
    },
    {
      "observation": "El screenshot muestra navegación comercial y controles de carrusel, sin texto que declare un proceso de varios pasos. Los puntos indican diapositivas, no progreso hacia una meta; Q es falso. Su lectura en screenshot hace que la comparación entre canales para Q no sea limpia.",
      "node_ids": [
        799
      ],
      "region": {
        "x": 629,
        "y": 402.4,
        "w": 11,
        "h": 11
      },
      "severity": "baja"
    }
  ],
  "recommendations": [
    "Diferenciar la opción inicial del carrusel de categorías mediante tamaño, borde o agrupación propia cuando su prioridad justifique esa posición.",
    "Mantener visible el inicio del carrusel para que la jerarquía inicial pueda reconocerse sin depender de una opción recortada."
  ],
  "run": {
    "model_id": "gpt-6.1-sol",
    "runtime": "codex-cli",
    "repetition": 4,
    "prompt_hash": "048af697105472ecbc31c386d677dae3e5fcab04c74c8337ca603ff8967f0635",
    "captured_at": "2026-09-11T00:37:56.713Z",
    "decoding": {
      "model_reasoning_effort": "medium",
      "temperature": "no expuesto por el runtime",
      "top_p": "no expuesto por el runtime"
    },
    "capture_sha256": {
      "screenshot": "f4cab483e9d9d645530227e692be49a0ceeecdc10f11cbeb3aadf0bf415e1b96",
      "wireframe": "99cbf987bcccd9d8d84849a7a5030dbb114191cf9638f32fbc678a47b022f64d"
    },
    "measurements_version": "1.0.5",
    "protocol_version": "0.1.0"
  }
}
