{
  "group_id": "g4",
  "group_name": "Saliencia visual",
  "laws_subsumed": [
    "Efecto Von Restorff",
    "Atención selectiva"
  ],
  "channel": "screenshot",
  "not_applicable": false,
  "na_reason": null,
  "score": null,
  "trigger": null,
  "evidence_insufficient": true,
  "measurements": {
    "sets": 27,
    "g4_conjuntos_pares_total": 27,
    "I_total": 2,
    "Bn": 0,
    "Cn": 0,
    "channels_of_isolation": 0,
    "I_principal": 0,
    "P": null,
    "main_set_id": "g4:A#551",
    "jerarquia_entre_dos": null,
    "ancla_definida": false,
    "motivo_abstencion": "La combinación Bn=0 e I_principal=0 no está cubierta por las anclas conservadas.",
    "Bn_ids": [],
    "Cn_ids": [],
    "canales_aislamiento": [],
    "lectura_screenshot": [],
    "juicios_conjuntos": [
      {
        "conjunto": "g4:DIV#141",
        "equivalentes": false,
        "aislados_ids": []
      },
      {
        "conjunto": "g4:DIV#951",
        "equivalentes": false,
        "aislados_ids": []
      },
      {
        "conjunto": "g4:DIV#960",
        "equivalentes": false,
        "aislados_ids": []
      },
      {
        "conjunto": "g4:DIV#741",
        "equivalentes": false,
        "aislados_ids": []
      },
      {
        "conjunto": "g4:DIV#227",
        "equivalentes": false,
        "aislados_ids": []
      },
      {
        "conjunto": "g4:DIV#379",
        "equivalentes": false,
        "aislados_ids": []
      },
      {
        "conjunto": "g4:A#551",
        "equivalentes": true,
        "aislados_ids": []
      },
      {
        "conjunto": "g4:DIV#243",
        "equivalentes": false,
        "aislados_ids": []
      },
      {
        "conjunto": "g4:BUTTON#387",
        "equivalentes": true,
        "aislados_ids": []
      },
      {
        "conjunto": "g4:A#1007",
        "equivalentes": false,
        "aislados_ids": []
      },
      {
        "conjunto": "g4:BUTTON#250",
        "equivalentes": true,
        "aislados_ids": []
      },
      {
        "conjunto": "g4:DIV#810",
        "equivalentes": false,
        "aislados_ids": []
      },
      {
        "conjunto": "g4:SPAN#617",
        "equivalentes": false,
        "aislados_ids": []
      },
      {
        "conjunto": "g4:SPAN#561",
        "equivalentes": false,
        "aislados_ids": []
      },
      {
        "conjunto": "g4:SPAN#577",
        "equivalentes": false,
        "aislados_ids": []
      },
      {
        "conjunto": "g4:SPAN#593",
        "equivalentes": false,
        "aislados_ids": []
      },
      {
        "conjunto": "g4:SPAN#585",
        "equivalentes": false,
        "aislados_ids": []
      },
      {
        "conjunto": "g4:SPAN#498",
        "equivalentes": false,
        "aislados_ids": []
      },
      {
        "conjunto": "g4:SPAN#609",
        "equivalentes": false,
        "aislados_ids": []
      },
      {
        "conjunto": "g4:SPAN#569",
        "equivalentes": false,
        "aislados_ids": []
      },
      {
        "conjunto": "g4:SPAN#488",
        "equivalentes": false,
        "aislados_ids": []
      },
      {
        "conjunto": "g4:SPAN#553",
        "equivalentes": false,
        "aislados_ids": []
      },
      {
        "conjunto": "g4:SPAN#601",
        "equivalentes": false,
        "aislados_ids": []
      },
      {
        "conjunto": "g4:SPAN#752",
        "equivalentes": false,
        "aislados_ids": []
      },
      {
        "conjunto": "g4:BUTTON#426",
        "equivalentes": true,
        "aislados_ids": [
          431
        ]
      },
      {
        "conjunto": "g4:A#822",
        "equivalentes": true,
        "aislados_ids": [
          823
        ]
      },
      {
        "conjunto": "g4:A#307",
        "equivalentes": true,
        "aislados_ids": []
      }
    ]
  },
  "findings": [
    {
      "observation": "La navegación principal presenta pares equivalentes sin un aislado: las diferencias de ancho responden a las etiquetas, no a un énfasis visual. Bn=0 e I_principal=0 requieren abstención por falta de ancla.",
      "node_ids": [
        553,
        561,
        569,
        577,
        585,
        593,
        601,
        609,
        617
      ],
      "region": {
        "x": 0,
        "y": 200,
        "w": 1440,
        "h": 66
      },
      "severity": "media"
    },
    {
      "observation": "Los candidatos 243, 379 y 551 son cabeceras convencionales, no navegación camuflada como publicidad. Los candidatos de cromo no certifican contenido sustantivo camuflado; su distancia RGB global no mide contraste WCAG.",
      "node_ids": [
        243,
        379,
        551
      ],
      "region": {
        "x": 0,
        "y": 0,
        "w": 1440,
        "h": 266
      },
      "severity": "baja"
    },
    {
      "observation": "La evaluación se limita a los candidatos suministrados. Los contenedores heterogéneos, componentes internos y cajas parciales no certifican nuevos conjuntos equivalentes; no se añaden pares omitidos.",
      "node_ids": [],
      "region": {
        "x": 0,
        "y": 0,
        "w": 1440,
        "h": 900
      },
      "severity": "baja"
    }
  ],
  "recommendations": [],
  "run": {
    "model_id": "gpt-6.1-sol",
    "runtime": "codex-cli",
    "repetition": 2,
    "prompt_hash": "a7347675bd8a9d2d149bbc6b1e6e2ddb22abee03d4ffd46e1756d0c0641d65e6",
    "captured_at": "2026-09-11T00:40:20.089Z",
    "decoding": {
      "model_reasoning_effort": "low",
      "temperature": "no expuesto por el runtime",
      "top_p": "no expuesto por el runtime"
    },
    "capture_sha256": {
      "screenshot": "c16778f3fe1b83f99a7288ec4b814006e6c45cf07685281e85041d7f0f73697a",
      "wireframe": "6aea3741cf64cab40b431a1f768eb85301eea79ae0ec1ebc0a6c52e7b42dc983"
    },
    "measurements_version": "1.0.6",
    "protocol_version": "0.1.0"
  }
}
