{
  "group_id": "g4",
  "group_name": "Saliencia visual",
  "laws_subsumed": [
    "Efecto Von Restorff",
    "Atención selectiva"
  ],
  "channel": "screenshot",
  "not_applicable": false,
  "na_reason": null,
  "score": null,
  "trigger": null,
  "evidence_insufficient": true,
  "measurements": {
    "sets": 13,
    "g4_conjuntos_pares_total": 13,
    "I_total": 2,
    "Bn": 0,
    "Cn": 0,
    "channels_of_isolation": 0,
    "I_principal": 0,
    "P": null,
    "main_set_id": "g4:DIV#1038",
    "jerarquia_entre_dos": null,
    "ancla_definida": false,
    "motivo_abstencion": "El conjunto principal de navegación presenta Bn=0 e I_principal=0; ninguna ancla cubre esta combinación. Los candidatos omitidos por la medición no se incorporan y los conjuntos ocultos no permiten certificar equivalencia visual.",
    "Bn_ids": [],
    "Cn_ids": [],
    "canales_aislamiento": [],
    "lectura_screenshot": [],
    "juicios_conjuntos": [
      {
        "conjunto": "g4:DIV#1020",
        "equivalentes": false,
        "aislados_ids": []
      },
      {
        "conjunto": "g4:DIV#1694",
        "equivalentes": false,
        "aislados_ids": []
      },
      {
        "conjunto": "g4:DIV#1704",
        "equivalentes": false,
        "aislados_ids": []
      },
      {
        "conjunto": "g4:DIV#1751",
        "equivalentes": false,
        "aislados_ids": []
      },
      {
        "conjunto": "g4:DIV#1821",
        "equivalentes": false,
        "aislados_ids": []
      },
      {
        "conjunto": "g4:DIV#1025",
        "equivalentes": false,
        "aislados_ids": []
      },
      {
        "conjunto": "g4:DIV#1038",
        "equivalentes": true,
        "aislados_ids": []
      },
      {
        "conjunto": "g4:DIV#3686",
        "equivalentes": false,
        "aislados_ids": []
      },
      {
        "conjunto": "g4:A#1905",
        "equivalentes": false,
        "aislados_ids": []
      },
      {
        "conjunto": "g4:A#2184",
        "equivalentes": false,
        "aislados_ids": []
      },
      {
        "conjunto": "g4:BUTTON#3699",
        "equivalentes": true,
        "aislados_ids": [
          3704
        ]
      },
      {
        "conjunto": "g4:BUTTON#1866",
        "equivalentes": true,
        "aislados_ids": [
          1869
        ]
      },
      {
        "conjunto": "g4:INPUT#1643",
        "equivalentes": false,
        "aislados_ids": []
      }
    ]
  },
  "findings": [
    {
      "observation": "Los miembros suministrados de la navegación mantienen un tratamiento visual uniforme. Con Bn=0 e I_principal=0, la rúbrica no define un nivel.",
      "node_ids": [
        1069,
        1633,
        1643,
        1673
      ],
      "region": {
        "x": 531.7,
        "y": 0,
        "w": 908.3,
        "h": 94
      },
      "severity": "media"
    },
    {
      "observation": "La cabecera es navegación convencional, no contenido tratado como publicidad. Los candidatos de cromo corresponden a controles auxiliares y no certifican contenido sustantivo camuflado; la distancia RGB no demuestra contraste local.",
      "node_ids": [
        1025
      ],
      "region": {
        "x": 20,
        "y": 0,
        "w": 1420,
        "h": 94
      },
      "severity": "baja"
    },
    {
      "observation": "La franja de cookies oculta los miembros de los conjuntos g4:A#1905 y g4:A#2184. Sus rasgos y parentesco no permiten certificar equivalencia visual sobre esta captura.",
      "node_ids": [
        1907,
        1910,
        1913,
        1916,
        1919,
        2188,
        2193
      ],
      "region": {
        "x": 0,
        "y": 798,
        "w": 1440,
        "h": 102
      },
      "severity": "media"
    }
  ],
  "recommendations": [],
  "run": {
    "model_id": "gpt-6.1-sol",
    "runtime": "codex-cli",
    "repetition": 3,
    "prompt_hash": "a01dc38e36dcd74cf60ea6fee8ba8d8f19cf70d7a20928d49e6bc3b2ccdc99e7",
    "captured_at": "2026-09-11T00:40:14.626Z",
    "decoding": {
      "model_reasoning_effort": "low",
      "temperature": "no expuesto por el runtime",
      "top_p": "no expuesto por el runtime"
    },
    "capture_sha256": {
      "screenshot": "951643f1d8683f129ff59b4c4d74a56bb7c28c304d06fe11af123ae24ea5d621",
      "wireframe": "b24da70f1980e54d043c8b9fded9dbb76336acf2c28ac912f909978510ae4e3b"
    },
    "measurements_version": "1.0.6",
    "protocol_version": "0.1.0"
  }
}
